{
  "schemaVersion": "calllint.corpus.case.v1",
  "caseId": "C018-review-brave-apikey-env",
  "title": "Brave Search server with an API-key env is REVIEW",
  "curationStatus": "real-public-snapshot",
  "riskTheme": [
    "env"
  ],
  "origin": {
    "kind": "public-repository",
    "description": "Public documentation config from modelcontextprotocol/servers-archived (src/brave-search/README.md). Unmodified snippet; placeholders such as <YOUR_TOKEN> are upstream's own.",
    "url": "https://github.com/modelcontextprotocol/servers-archived",
    "commit": "9be4674d1ddf8c469e6461a27a337eeb65f76c2e",
    "license": "MIT",
    "retrievedAt": "2026-06-17T00:00:00.000Z",
    "redactions": []
  },
  "input": {
    "path": "input/mcp.json",
    "format": "mcp-json"
  },
  "humanExpectation": {
    "verdict": "REVIEW",
    "rationale": "An API-key env is a credential surface to review; the pinned image and docker env flag are benign, so the verdict is REVIEW rather than BLOCK.",
    "knownLimitations": [
      "The key name matches the credential heuristic; the placeholder value is not validated."
    ]
  },
  "executionPolicy": {
    "executeTarget": false,
    "allowNetwork": false,
    "allowFilesystemMutation": false
  }
}
